{
  "claims": [
    {
      "id": "claim_001",
      "section": "What the Target System Is",
      "statement": "The project is named \"rest-express\" (from package.json)",
      "confidence": 0.6,
      "evidence": [
        {
          "path": "package.json",
          "line_start": 2,
          "line_end": 2,
          "snippet_hash": "a1f1a980b4b8",
          "display": "package.json:2",
          "snippet_hash_verified": true
        }
      ],
      "status": "evidenced"
    },
    {
      "id": "claim_002",
      "section": "How to Use the Target System",
      "statement": "npm script \"dev\" runs: NODE_ENV=development tsx server/index.ts",
      "confidence": 0.6,
      "evidence": [
        {
          "path": "package.json",
          "line_start": 7,
          "line_end": 7,
          "snippet_hash": "fd240a9dc053",
          "display": "package.json:7",
          "snippet_hash_verified": true
        }
      ],
      "status": "evidenced"
    },
    {
      "id": "claim_003",
      "section": "How to Use the Target System",
      "statement": "npm script \"build\" runs: tsx script/build.ts",
      "confidence": 0.6,
      "evidence": [
        {
          "path": "package.json",
          "line_start": 8,
          "line_end": 8,
          "snippet_hash": "79d8bdf275d6",
          "display": "package.json:8",
          "snippet_hash_verified": true
        }
      ],
      "status": "evidenced"
    },
    {
      "id": "claim_004",
      "section": "How to Use the Target System",
      "statement": "npm script \"start\" runs: NODE_ENV=production node dist/index.cjs",
      "confidence": 0.6,
      "evidence": [
        {
          "path": "package.json",
          "line_start": 9,
          "line_end": 9,
          "snippet_hash": "020435ddf436",
          "display": "package.json:9",
          "snippet_hash_verified": true
        }
      ],
      "status": "evidenced"
    },
    {
      "id": "claim_005",
      "section": "Integration Surface",
      "statement": "Key dependencies: drizzle-orm, express, openai, react",
      "confidence": 0.5,
      "evidence": [
        {
          "path": "package.json",
          "line_start": 13,
          "line_end": 13,
          "snippet_hash": "f7eebadd079d",
          "display": "package.json:13",
          "snippet_hash_verified": true
        }
      ],
      "status": "evidenced"
    },
    {
      "id": "claim_006",
      "section": "What the Target System Is",
      "statement": "Python project named \"program-totality-analyzer\" (from pyproject.toml)",
      "confidence": 0.5,
      "evidence": [
        {
          "path": "pyproject.toml",
          "line_start": 2,
          "line_end": 2,
          "snippet_hash": "f0d4a96fe7d6",
          "display": "pyproject.toml:2",
          "snippet_hash_verified": true
        }
      ],
      "status": "evidenced"
    },
    {
      "id": "claim_007",
      "section": "How to Use the Target System",
      "statement": "Server binds to 0.0.0.0 (all interfaces)",
      "confidence": 0.55,
      "evidence": [
        {
          "path": "server/index.ts",
          "line_start": 92,
          "line_end": 92,
          "snippet_hash": "75d345a78f84",
          "display": "server/index.ts:92",
          "snippet_hash_verified": true
        },
        {
          "path": "server/index.ts",
          "line_start": 96,
          "line_end": 96,
          "snippet_hash": "9b7206f3d09a",
          "display": "server/index.ts:96",
          "snippet_hash_verified": true
        }
      ],
      "status": "evidenced"
    },
    {
      "id": "claim_008",
      "section": "How to Use the Target System",
      "statement": "Server port is configured via environment variable",
      "confidence": 0.55,
      "evidence": [
        {
          "path": "server/index.ts",
          "line_start": 92,
          "line_end": 92,
          "snippet_hash": "75d345a78f84",
          "display": "server/index.ts:92",
          "snippet_hash_verified": true
        },
        {
          "path": "server/index.ts",
          "line_start": 96,
          "line_end": 96,
          "snippet_hash": "9b7206f3d09a",
          "display": "server/index.ts:96",
          "snippet_hash_verified": true
        }
      ],
      "status": "evidenced"
    },
    {
      "id": "claim_009",
      "section": "Data & Security Posture",
      "statement": "System requires 3 secret(s): DATABASE_URL, AI_INTEGRATIONS_OPENAI_API_KEY, AI_INTEGRATIONS_OPENAI_BASE_URL",
      "confidence": 0.55,
      "evidence": [
        {
          "path": "drizzle.config.ts",
          "line_start": 3,
          "line_end": 3,
          "snippet_hash": "a19790628fbe",
          "display": "drizzle.config.ts:3",
          "snippet_hash_verified": true
        },
        {
          "path": "server/replit_integrations/audio/client.ts",
          "line_start": 10,
          "line_end": 10,
          "snippet_hash": "05da5f1b1281",
          "display": "server/replit_integrations/audio/client.ts:10",
          "snippet_hash_verified": true
        },
        {
          "path": "server/replit_integrations/audio/client.ts",
          "line_start": 11,
          "line_end": 11,
          "snippet_hash": "1f70e6a77d42",
          "display": "server/replit_integrations/audio/client.ts:11",
          "snippet_hash_verified": true
        }
      ],
      "status": "evidenced"
    },
    {
      "id": "claim_010",
      "section": "Data & Security Posture",
      "statement": "Secret \"DATABASE_URL\" is referenced in 4 file(s)",
      "confidence": 0.5,
      "evidence": [
        {
          "path": "drizzle.config.ts",
          "line_start": 3,
          "line_end": 3,
          "snippet_hash": "a19790628fbe",
          "display": "drizzle.config.ts:3",
          "snippet_hash_verified": true
        },
        {
          "path": "drizzle.config.ts",
          "line_start": 12,
          "line_end": 12,
          "snippet_hash": "1005be19f14a",
          "display": "drizzle.config.ts:12",
          "snippet_hash_verified": true
        }
      ],
      "status": "evidenced"
    },
    {
      "id": "claim_011",
      "section": "Data & Security Posture",
      "statement": "Secret \"AI_INTEGRATIONS_OPENAI_API_KEY\" is referenced in 3 file(s)",
      "confidence": 0.5,
      "evidence": [
        {
          "path": "server/replit_integrations/audio/client.ts",
          "line_start": 10,
          "line_end": 10,
          "snippet_hash": "05da5f1b1281",
          "display": "server/replit_integrations/audio/client.ts:10",
          "snippet_hash_verified": true
        },
        {
          "path": "server/replit_integrations/chat/routes.ts",
          "line_start": 6,
          "line_end": 6,
          "snippet_hash": "05da5f1b1281",
          "display": "server/replit_integrations/chat/routes.ts:6",
          "snippet_hash_verified": true
        }
      ],
      "status": "evidenced"
    },
    {
      "id": "claim_012",
      "section": "Data & Security Posture",
      "statement": "Secret \"AI_INTEGRATIONS_OPENAI_BASE_URL\" is referenced in 3 file(s)",
      "confidence": 0.5,
      "evidence": [
        {
          "path": "server/replit_integrations/audio/client.ts",
          "line_start": 11,
          "line_end": 11,
          "snippet_hash": "1f70e6a77d42",
          "display": "server/replit_integrations/audio/client.ts:11",
          "snippet_hash_verified": true
        },
        {
          "path": "server/replit_integrations/chat/routes.ts",
          "line_start": 7,
          "line_end": 7,
          "snippet_hash": "1f70e6a77d42",
          "display": "server/replit_integrations/chat/routes.ts:7",
          "snippet_hash_verified": true
        }
      ],
      "status": "evidenced"
    },
    {
      "id": "claim_013",
      "section": "Integration Surface",
      "statement": "External API dependency: OpenAI",
      "confidence": 0.45,
      "evidence": [
        {
          "path": "server/replit_integrations/audio/client.ts",
          "line_start": 1,
          "line_end": 1,
          "snippet_hash": "1d3dd608c3bb",
          "display": "server/replit_integrations/audio/client.ts:1",
          "snippet_hash_verified": true
        },
        {
          "path": "server/replit_integrations/audio/routes.ts",
          "line_start": 3,
          "line_end": 3,
          "snippet_hash": "2f87d29d3b03",
          "display": "server/replit_integrations/audio/routes.ts:3",
          "snippet_hash_verified": true
        }
      ],
      "status": "evidenced"
    },
    {
      "id": "claim_014",
      "section": "How to Use the Target System",
      "statement": "Replit run command: npm run dev",
      "confidence": 0.55,
      "evidence": [
        {
          "path": ".replit",
          "line_start": 2,
          "line_end": 2,
          "snippet_hash": "96fa2e5505e4",
          "display": ".replit:2",
          "snippet_hash_verified": true
        },
        {
          "path": ".replit",
          "line_start": 5,
          "line_end": 5,
          "snippet_hash": "550b970621c2",
          "display": ".replit:5",
          "snippet_hash_verified": true
        }
      ],
      "status": "evidenced"
    },
    {
      "id": "claim_015",
      "section": "What the Target System Is",
      "statement": "Primary languages: TypeScript (90 files), JavaScript (2 files), Python (2 files)",
      "confidence": 0.2,
      "evidence": [],
      "status": "inferred"
    },
    {
      "id": "claim_016",
      "section": "What the Target System Is",
      "statement": "Project has both client/ and server/ directories (full-stack structure)",
      "confidence": 0.2,
      "evidence": [],
      "status": "inferred"
    },
    {
      "id": "claim_017",
      "section": "Integration Surface",
      "statement": "Database schema/migration files detected: drizzle.config.ts, server/db.ts, shared/schema.ts",
      "confidence": 0.4,
      "evidence": [
        {